{
  "schema_version": "0.1",
  "checkpoint_id": "urn:owc:checkpoint:fixture-001",
  "created_at": "2026-08-07T08:10:00Z",
  "session_id": "urn:owc:session:fixture-001",
  "capture_providers": [
    {
      "name": "entire",
      "external_session_id": "entire-fixture-session-001"
    }
  ],
  "work": {
    "work_item_id": "OWC-FIXTURE-1",
    "title": "Add an offline status command",
    "objective": "Add an offline status command without changing network behavior.",
    "constraints": ["Verification must not require network access."]
  },
  "parents": [],
  "event_refs": [
    {
      "event_id": "urn:owc:event:fixture-session-started-001",
      "path": "events/session-started.json",
      "digest": "sha256:4c8ee91e1ee1fb05806f4cf4c24f21058533dbcadc471f93c6bbad641db5d631"
    }
  ],
  "git_state": {
    "path": "state/git-state.json",
    "digest": "sha256:70e56c5f7fca6f8b4b21342d6679e240669341645a71e2869af4392991eb86a8"
  },
  "artifacts": [],
  "claims": [],
  "evidence": [],
  "open_questions": [
    "Which command output should the first implementation expose?"
  ],
  "exclusions": [
    {
      "category": "raw-transcript",
      "reason": "Raw provider transcripts are excluded by the v0 default policy.",
      "policy": "owc-v0-default-private"
    }
  ],
  "next_action": {
    "statement": "Inspect the current command surface and implement the smallest offline-only status response.",
    "source_paths": ["events/session-started.json", "state/git-state.json"]
  }
}
